{"schemaVersion":1,"artifactType":"cross-source-analysis-report","generatedAt":"2026-09-17T10:05:00Z","reportId":"cross-source-report-example123","reportSha256":"2f1f48f027d0edc367b239e000a63334bdb1154617494a3f8ce29ba4944bbf68","status":"ready","qualityTier":"reliable_for_description","sources":{"ga4":{"reportId":"report-example"},"searchConsole":{"reportId":"search-console-report-example"}},"periods":{"current":{"from":"2026-08-17","to":"2026-09-13"},"previous":{"from":"2026-07-20","to":"2026-08-16"}},"boundaryAlignment":"date_labels_only","mappingSummary":{"counts":{"exact":1},"total":1},"pageMappings":[],"deviceMappings":[],"facts":[],"calculations":[],"interpretations":[],"findings":[],"limitations":[],"recommendations":[],"questions":[],"safeNextStep":"Review source evidence.","networkUsed":false,"mutationPerformed":false}
